word_de,article,pos,translation_ru,translation_uk,example_de,example_ru,example_uk,categories
"Langsamer, bitte",-,phrase,"помедленнее, пожалуйста","повільніше, будь ласка","Sprechen Sie etwas langsamer, bitte.","Говорите немного медленнее, пожалуйста.","Говоріть трохи повільніше, будь ласка.",
Lebensmittel,das,noun,продукты,продукти,Wir kaufen Lebensmittel im Supermarkt.,Мы покупаем продукты в супермаркете.,Купуємо продукти в супермаркеті.,food
Lehrer,der,noun,учитель,вчитель,Unser Lehrer ist geduldig.,Наш учитель терпелив.,Наш вчитель терплячий.,study
Lehrer,-,phrase,,,Lehrer.,,,
Lehrerin,die,noun,учительница,вчителька,Die Lehrerin erklärt alles sehr klar.,Учительница объясняет всё очень ясно.,Вчителька пояснює все дуже чітко.,study
Leute,die,noun,люди,люди,Viele Leute warten an der Haltestelle.,Много людей ждут на остановке.,Багато людей чекають на зупинці.,
Liter,der,noun,литр,літр,Ich kaufe einen Liter Milch.,Я куплю литр молока.,Я куплю літр молока.,food
Mahlzeit,die,noun,приём пищи,прийом їжі,Gute Mahlzeit! Wir essen jetzt.,Приятного аппетита! Мы сейчас едим.,Смачного! Ми зараз їмо.,food
Mai,der,noun,май,травень,Im Mai blühen viele Bäume.,В мае цветёт много деревьев.,У травні цвітуть багато дерев.,time
Mama,die,noun,мама,мама,Meine Mama arbeitet im Krankenhaus.,Моя мама работает в больнице.,Моя мама працює в лікарні.,family
Mann,der,noun,мужчина,чоловік,Der Mann hilft der Nachbarin.,Мужчина помогает соседке.,Чоловік допомагає сусідці.,family
Markt,der,noun,рынок,ринок,Am Samstag ist Markt in der Stadt.,В субботу в городе рынок.,У суботу в місті ярмарок.,city
Messer,das,noun,нож,ніж,Das Messer ist sehr scharf.,Нож очень острый.,Ніж дуже гострий.,home
Meter,der,noun,метр,метр,Der Tisch ist zwei Meter lang.,Стол два метра длиной.,Стіл два метри завдовжки.,home
Milch,die,noun,молоко,молоко,Ich trinke morgens Milch im Kaffee.,Я пью утром молоко в кофе.,П’ю зранку молоко в каві.,food
Minute,die,noun,минута,хвилина,Warte bitte eine Minute.,"Подожди, пожалуйста, минуту.","Зачекай, будь ласка, хвилину.",time
Mir geht es gut,-,phrase,у меня всё хорошо,в мене все добре,"Danke, mir geht es gut.","Спасибо, у меня всё хорошо.","Дякую, в мене все добре.",
Mittag,der,noun,полдень,опівдень,Wir essen gegen Mittag zu Hause.,Мы едим около полудня дома.,Їмо вдома близько опівдня.,time
Mittwoch,der,noun,среда,середа,Am Mittwoch habe ich Sport.,В среду у меня спорт.,У середу в мене спорт.,time
Monat – die Monate,-,phrase,,,Monat – die Monate.,,,
Montag,der,noun,понедельник,понеділок,Am Montag habe ich einen Termin.,В понедельник у меня встреча.,У понеділок у мене зустріч.,time
Mutter,die,noun,мать,мати,Meine Mutter ruft mich später an.,Моя мама позже мне позвонит.,Моя мати зателефонує мені пізніше.,family
Mädchen,das,noun,девочка,дівчинка,Das Mädchen liest ein Buch.,Девочка читает книгу.,Дівчинка читає книжку.,family
März,der,noun,март,березень,Im März wird es langsam warm.,В марте становится постепенно тепло.,У березні стає потроху тепло.,time
Nacht,die,noun,ночь,ніч,In der Nacht ist es ruhig.,Ночью тихо.,Уночі тихо.,time
Name,der,noun,имя,ім’я,Wie ist dein Name?,Как твоё имя?,Як твоє ім’я?,
Nase,die,noun,нос,ніс,Meine Nase ist ein bisschen kalt.,Мой нос немного замёрз.,Мій ніс трохи змерз.,health
Natürlich,-,adjective,,,Es ist sehr Natürlich.,Это очень Natürlich.,Це дуже Natürlich.,
Nein,-,adjective,,,Es ist sehr Nein.,Это очень Nein.,Це дуже Nein.,
"Noch einmal, bitte",-,phrase,"ещё раз, пожалуйста","ще раз, будь ласка","Können Sie das noch einmal, bitte?","Можете это ещё раз, пожалуйста?","Можете це ще раз, будь ласка?",
Norden,-,adjective,,,Es ist sehr Norden.,Это очень Norden.,Це дуже Norden.,
November,der,noun,ноябрь,листопад,Im November ist es oft grau.,В ноябре часто серо.,У листопаді часто сіро.,time|weather
Nummer,die,noun,номер,номер,Wie ist deine Nummer?,Какой у тебя номер?,Який у тебе номер?,
Oktober,der,noun,октябрь,жовтень,Im Oktober fallen die Blätter.,В октябре опадают листья.,У жовтні опадає листя.,time
Onkel,der,noun,дядя,дядько,Mein Onkel wohnt in Wien.,Мой дядя живёт в Вене.,Мій дядько живе у Відні.,family
Osten,-,adjective,,,Es ist sehr Osten.,Это очень Osten.,Це дуже Osten.,
Papier,das,noun,бумага,папір,Hast du ein Blatt Papier?,У тебя есть лист бумаги?,Маєш аркуш паперу?,study
Park,der,noun,парк,парк,Wir gehen am Nachmittag in den Park.,Днём идём в парк.,Після обіду йдемо до парку.,city
Pass,der,noun,паспорт,паспорт,Vergiss deinen Pass nicht!,Не забудь свой паспорт!,Не забудь свій паспорт!,
Pfund,das,noun,фунт,фунт,Das kostet zehn Pfund.,Это стоит десять фунт.,Це коштує десять фунт.,other
Platz,der,noun,место,місце,Ist hier noch ein Platz frei?,Здесь ещё есть свободное место?,Тут ще є вільне місце?,city
Post,die,noun,почта,пошта,Die Post ist heute geschlossen.,Почта сегодня закрыта.,Пошта сьогодні зачинена.,city
Poster,das,noun,плакат,плакат,Das Poster hängt über dem Bett.,Плакат висит над кроватью.,Плакат висить над ліжком.,
Postleitzahl,die,noun,почтовый индекс,поштовий індекс,Wie ist Ihre Postleitzahl?,Какой у вас почтовый индекс?,Який у вас поштовий індекс?,city
Problem,das,noun,проблема,проблема,"Kein Problem, ich kümmere mich darum.","Без проблем, я займусь этим.","Без проблем, я цим займуся.",
Radio,das,noun,радио,радіо,Ich höre morgens Radio im Auto.,По утрам слушаю радио в машине.,Вранці слухаю радіо в машині.,
Regen,der,noun,дождь,дощ,Morgen gibt es viel Regen.,Завтра будет много дождя.,Завтра буде багато дощу.,weather
Reis,der,noun,рис,рис,Ich koche heute Reis mit Gemüse.,Сегодня я готовлю рис с овощами.,Сьогодні готую рис із овочами.,food
Restaurant,das,noun,ресторан,ресторан,Das Restaurant ist immer voll.,Ресторан всегда полон.,Ресторан завжди повний.,city|food
Saft,der,noun,сок,сік,Der Apfelsaft schmeckt frisch.,Яблочный сок на вкус свежий.,Яблучний сік має свіжий смак.,food
Salat,der,noun,салат,салат,Zum Abendessen gibt es Salat.,На ужин будет салат.,На вечерю буде салат.,food
Samstag,der,noun,суббота,субота,Am Samstag schlafen wir länger.,В субботу мы спим дольше.,У суботу ми спимо довше.,time
Satz,der,noun,предложение,речення,Der Satz ist grammatisch richtig.,Предложение грамматически правильное.,Речення граматично правильне.,study
Schade!,-,adjective,,,Es ist sehr Schade!.,Это очень Schade!.,Це дуже Schade!.,
Schnee,der,noun,снег,сніг,Morgen fällt viel Schnee.,Завтра выпадет много снега.,Завтра випаде багато снігу.,weather
Schule,die,noun,школа,школа,Die Schule beginnt um acht Uhr.,Школа начинается в восемь.,Школа починається о восьмій.,study
Schwester,die,noun,сестра,сестра,Meine Schwester wohnt in Hamburg.,Моя сестра живёт в Гамбурге.,Моя сестра живе в Гамбурзі.,family
Schönen Tag noch,-,phrase,,,Schönen Tag noch.,,,
Schüler,der,noun,ученик,учень,Jeder Schüler hat ein Heft.,У каждого ученика есть тетрадь.,Кожен учень має зошит.,study
Schülerin,die,noun,ученица,учениця,Die neue Schülerin ist sehr fleißig.,Новая ученица очень старательная.,Нова учениця дуже старанна.,study
See,der,noun,озеро,озеро,Der See ist heute ganz ruhig.,Озеро сегодня совсем спокойное.,Озеро сьогодні зовсім спокійне.,
Seit wann,-,phrase,,,Seit wann.,,,
Seite,die,noun,страница,сторінка,"Öffne die Seite zwölf, bitte.","Открой, пожалуйста, страницу двенадцать.","Відкрий, будь ласка, сторінку дванадцять.",study
September,der,noun,сентябрь,вересень,Im September beginnt die Schule.,В сентябре начинается школа.,У вересні починається школа.,time|study
Servus,-,adjective,,,Es ist sehr Servus.,Это очень Servus.,Це дуже Servus.,
Sommer,-,adjective,,,Es ist sehr Sommer.,Это очень Sommer.,Це дуже Sommer.,
Sonne,die,noun,солнце,сонце,Die Sonne scheint den ganzen Tag.,Солнце светит весь день.,Сонце світить увесь день.,weather
Sonne scheint,-,phrase,,,Sonne scheint.,,,
Sonntag,der,noun,воскресенье,неділя,Am Sonntag besuchen wir Freunde.,В воскресенье мы навещаем друзей.,У неділю відвідуємо друзів.,time
Sonst noch etwas?,-,phrase,,,Sonst noch etwas?.,,,
"Sprechen Sie langsamer, bitte",-,phrase,,,"Sprechen Sie langsamer, bitte.",,,
Stadt,die,noun,город,місто,Die Stadt wächst sehr schnell.,Город растёт очень быстро.,Місто росте дуже швидко.,city
Stift,der,noun,ручка/карандаш,ручка/олівець,Kann ich deinen Stift benutzen?,Можно воспользоваться твоей ручкой?,Можна скористатися твоєю ручкою?,study
Stimmt so,-,phrase,,,Stimmt so.,,,
Student,der,noun,студент,студент,Der Student arbeitet nebenbei.,Студент подрабатывает.,Студент підробляє.,study
Studentin,die,noun,студентка,студентка,Die Studentin sucht eine Wohnung.,Студентка ищет жильё.,Студентка шукає житло.,study
Stunde,die,noun,час,година,Die Stunde ist schnell vorbei.,Час быстро прошёл.,Година швидко минула.,time
Super!,-,adjective,,,Es ist sehr Super!.,Это очень Super!.,Це дуже Super!.,
Supermarkt,der,noun,супермаркет,супермаркет,Der Supermarkt hat bis zehn auf.,Супермаркет открыт до десяти.,Супермаркет працює до десятої.,city
Suppe,die,noun,суп,суп,Die Suppe ist heute sehr lecker.,Суп сегодня очень вкусный.,Суп сьогодні дуже смачний.,food
Süden,-,adjective,,,Es ist sehr Süden.,Это очень Süden.,Це дуже Süden.,
Tag,der,noun,день,день,Jeden Tag lerne ich ein bisschen Deutsch.,Каждый день я немного учу немецкий.,Щодня я трохи вчу німецьку.,time
Tag – die Tage,-,phrase,,,Tag – die Tage.,,,
Tasche,die,noun,сумка,сумка,Deine Tasche ist auf dem Stuhl.,Твоя сумка на стуле.,Твоя сумка на стільці.,
Tee,der,noun,чай,чай,Möchten Sie grünen Tee?,Хотите зелёный чай?,Хочете зелений чай?,food
Tisch,der,noun,стол,стіл,Der Tisch steht am Fenster.,Стол стоит у окна.,Стіл стоїть біля вікна.,home
Tochter,die,noun,дочь,дочка,Meine Tochter ist acht Jahre alt.,Моей дочери восемь лет.,Моїй дочці вісім років.,family
Toll!,-,adjective,,,Es ist sehr Toll!.,Это очень Toll!.,Це дуже Toll!.,
Tomate,die,noun,помидор,помідор,Die Tomate ist sehr frisch.,Помидор очень свежий.,Помідор дуже свіжий.,food
Tschüss,-,phrase,пока,бувай,"Tschüss, bis morgen!","Пока, до завтра!","Бувай, до завтра!",
Tür,die,noun,дверь,двері,Mach bitte die Tür leise zu.,"Закрой, пожалуйста, дверь тихо.","Будь ласка, зачиняй двері тихо.",home
Uhr,die,noun,часы,годинник,Meine Uhr geht ein bisschen vor.,Мои часы немного спешат.,Мій годинник трохи поспішає.,time
Um 7 Uhr,-,phrase,,,Um 7 Uhr.,,,
Um wie viel Uhr,-,phrase,,,Um wie viel Uhr.,,,
Und dir?,-,phrase,,,Und dir?.,,,
Universität,die,noun,университет,університет,Die Universität ist modern ausgestattet.,Университет современно оснащён.,Університет сучасно оснащений.,study
Vater,der,noun,отец,батько,Mein Vater arbeitet als Ingenieur.,Мой отец работает инженером.,Мій батько працює інженером.,family
Verwandte,der,noun,родственник,родич,Ein Verwandter wohnt bei uns.,Один родственник живёт у нас.,Один родич живе в нас.,family
Vielen Dank,-,phrase,,,Vielen Dank.,,,
Vielleicht,-,adverb,возможно,можливо,Vielleicht komme ich später.,"Возможно, я приду позже.","Можливо, я прийду пізніше.",
Vogel,der,noun,птица,птах,Der Vogel sitzt auf dem Ast.,Птица сидит на ветке.,Птах сидить на гілці.,
Wann trifft ihr euch?,-,phrase,,,Wann trifft ihr euch?.,,,
Was darf’s sein?,-,phrase,,,Was darf’s sein?.,,,
Was kostet das,-,phrase,сколько это стоит,скільки це коштує,"Entschuldigung, was kostet das?","Извините, сколько это стоит?","Вибачте, скільки це коштує?",city
Was kostet das?,-,phrase,,,Was kostet das?.,,,
Was machst du beruflich?,-,phrase,,,Was machst du beruflich?.,,,
Wasser,das,noun,вода,вода,Ich trinke viel Wasser am Tag.,Я пью много воды в день.,Я п’ю багато води за день.,food
Westen,-,adjective,,,Es ist sehr Westen.,Это очень Westen.,Це дуже Westen.,
Wetter,das,noun,погода,погода,Das Wetter wird morgen besser.,Погода завтра станет лучше.,Погода завтра стане кращою.,weather
Wie alt bist du? – Ich bin,-,phrase,,,Wie alt bist du? – Ich bin.,,,
Wie bitte?,-,phrase,,,Wie bitte?.,,,
Wie geht’s Ihnen?,-,phrase,,,Wie geht’s Ihnen?.,,,
Wie geht’s dir?,-,phrase,,,Wie geht’s dir?.,,,
Wie heißen Sie,-,phrase,как вас зовут,як вас звати,Wie heißen Sie bitte?,"Скажите, как вас зовут.","Скажіть, як вас звати.",
Wie heißen Sie?,-,phrase,,,Wie heißen Sie?.,,,
Wie heißt du?,-,phrase,,,Wie heißt du?.,,,
Wie ist das Wetter?,-,phrase,,,Wie ist das Wetter?.,,,
Wie komme ich zum Bahnhof?,-,phrase,,,Wie komme ich zum Bahnhof?.,,,
Wie lange,-,phrase,,,Wie lange.,,,
Wie spät ist es?,-,phrase,,,Wie spät ist es?.,,,
Wie viel ist das?,-,phrase,,,Wie viel ist das?.,,,
Wind,der,noun,ветер,вітер,Heute weht starker Wind.,Сегодня дует сильный ветер.,Сьогодні дме сильний вітер.,weather
Winter,-,adjective,,,Es ist sehr Winter.,Это очень Winter.,Це дуже Winter.,
Wo ist,-,phrase,,,Wo ist.,,,
Wo ist die Toilette,-,phrase,где туалет,де туалет,"Wo ist die Toilette, bitte?","Подскажите, где туалет?","Підкажіть, де туалет?",city
Woche,die,noun,неделя,тиждень,Die Woche war stressig.,Неделя была напряжённой.,Тиждень був напруженим.,time
Woher kommen Sie?,-,phrase,,,Woher kommen Sie?.,,,
Wohnung,die,noun,квартира,квартира,Die Wohnung ist hell und ruhig.,Квартира светлая и тихая.,Квартира світла і тиха.,home
Wolke,die,noun,облако,хмара,Viele Wolken am Himmel.,На небе много облаков.,На небі багато хмар.,weather
Zeit,die,noun,время,час,Ich habe heute wenig Zeit.,У меня сегодня мало времени.,Сьогодні маю мало часу.,time
Zimmer,das,noun,комната,кімната,"Mein Zimmer ist klein, aber gemütlich.","Моя комната маленькая, но уютная.","Моя кімната маленька, але затишна.",home
Zug,der,noun,поезд,потяг,Der Zug kommt pünktlich an.,Поезд прибывает вовремя.,Потяг прибуває вчасно.,transport
Zum Mitnehmen oder hier?,-,phrase,,,Zum Mitnehmen oder hier?.,,,
abfahren,-,adjective,,,Es ist sehr abfahren.,Это очень abfahren.,Це дуже abfahren.,
abholen,-,adjective,,,Es ist sehr abholen.,Это очень abholen.,Це дуже abholen.,
acht,-,number,восемь,вісім,Die Apotheke öffnet um acht.,Аптека открывается в восемь.,Аптека відкривається о восьмій.,time|health|city
achtzehn,-,adjective,,,Es ist sehr achtzehn.,Это очень achtzehn.,Це дуже achtzehn.,
achtzig,-,adjective,,,Es ist sehr achtzig.,Это очень achtzig.,Це дуже achtzig.,
allein,-,adjective,один,сам,Heute Abend bin ich allein zu Hause.,Сегодня вечером я один дома.,Сьогодні ввечері я сам удома.,
alt,-,adjective,старый,старий,"Mein Handy ist alt, aber funktioniert noch.","Мой телефон старый, но ещё работает.","Мій телефон старий, але ще працює.",
ander,-,adjective,другой,інший,Wir nehmen heute einen anderen Bus.,Сегодня поедем на другом автобусе.,Сьогодні поїдемо іншим автобусом.,
anfangen,-,verb,начинать,починати,Der Kurs fängt morgen an.,Курс начинается завтра.,Курс починається завтра.,study
angenehm,-,adjective,приятный,приємний,Die Musik ist leise und angenehm.,Музыка тихая и приятная.,Музика тиха і приємна.,
ankommen,-,verb,прибывать,прибувати,Der Zug kommt pünktlich an.,Поезд прибывает вовремя.,Потяг прибуває вчасно.,transport
anrufen,-,verb,звонить,дзвонити,Ich rufe dich heute Abend an.,Я позвоню тебе сегодня вечером.,Я зателефоную тобі сьогодні ввечері.,
ansehen,-,adjective,,,Es ist sehr ansehen.,Это очень ansehen.,Це дуже ansehen.,
antworten,-,verb,отвечать,відповідати,Bitte antworte schnell.,"Пожалуйста, ответь быстро.","Будь ласка, відповідай швидко.",
anziehen,-,verb,надевать,вдягати,Ich ziehe meine Jacke an.,Я надеваю свою куртку.,Я вдягаю свою куртку.,home
arbeiten,-,verb,работать,працювати,Ich arbeite in einem Büro.,Я работаю в офисе.,Я працюю в офісі.,study|city
arbeitslos,-,adjective,безработный,безробітний,Er ist seit zwei Monaten arbeitslos.,Он без работы уже два месяца.,Він без роботи вже два місяці.,
arm,-,adjective,бедный,бідний,"Er ist nicht arm, nur sparsam.","Он не бедный, только экономный.","Він не бідний, тільки економний.",
auf,-,adjective,,,Es ist sehr auf.,Это очень auf.,Це дуже auf.,
aufhören,-,adjective,,,Es ist sehr aufhören.,Это очень aufhören.,Це дуже aufhören.,
aufmachen,-,adjective,,,Es ist sehr aufmachen.,Это очень aufmachen.,Це дуже aufmachen.,
aufstehen,-,verb,вставать,вставати,Ich stehe jeden Morgen um sieben auf.,Я встаю каждое утро в семь.,Я встаю щоранку о сьомій.,health
ausfüllen,-,adjective,,,Es ist sehr ausfüllen.,Это очень ausfüllen.,Це дуже ausfüllen.,
ausgehen,-,adjective,,,Es ist sehr ausgehen.,Это очень ausgehen.,Це дуже ausgehen.,
ausländisch,-,adjective,иностранный,іноземний,Ich lerne gern ausländische Sprachen.,Я охотно учу иностранные языки.,Я із задоволенням вчу іноземні мови.,
ausschalten,-,adjective,,,Es ist sehr ausschalten.,Это очень ausschalten.,Це дуже ausschalten.,
aussehen,-,verb,выглядеть,виглядати,Du siehst müde aus.,Ты выглядишь усталым.,Ти виглядаєш втомленим.,health
aussteigen,-,adjective,,,Es ist sehr aussteigen.,Это очень aussteigen.,Це дуже aussteigen.,
backen,-,verb,печь,пекти,Meine Oma backt Kuchen.,Моя бабушка печёт пироги.,Моя бабуся пече пироги.,food
baden,-,verb,купаться,купатися,Die Kinder baden im See.,Дети купаются в озере.,Діти купаються в озері.,
bald,-,adverb,скоро,скоро,Ich rufe dich bald an.,Я скоро тебе позвоню.,Я скоро тобі подзвоню.,
bauen,-,adjective,,,Es ist sehr bauen.,Это очень bauen.,Це дуже bauen.,
bedeuten,-,adjective,,,Es ist sehr bedeuten.,Это очень bedeuten.,Це дуже bedeuten.,
beginnen,-,verb,начинать,починати,Der Film beginnt um acht.,Фильм начинается в восемь.,Фільм починається о восьмій.,time|city
bekannt,-,adjective,известный,відомий,Das Café ist hier sehr bekannt.,Это кафе здесь очень известно.,Це кафе тут дуже відоме.,
bekommen,-,verb,получать,отримувати,Ich bekomme viele E-Mails.,Я получаю много писем.,Я отримую багато листів.,study|city
benutzen,-,verb,использовать,використовувати,Benutze bitte die andere Tür.,"Пожалуйста, пользуйся другой дверью.","Будь ласка, користуйся іншими дверима.",home
beschreiben,-,adjective,,,Es ist sehr beschreiben.,Это очень beschreiben.,Це дуже beschreiben.,
besuchen,-,verb,посещать,відвідувати,Wir besuchen am Sonntag Freunde.,Мы навещаем друзей в воскресенье.,Ми відвідуємо друзів у неділю.,family|time
bezahlen,-,verb,платить,платити,Ich bezahle mit Karte.,Я плачу картой.,Я плачу карткою.,city
billig,-,adjective,дешёвый,дешевий,Das Ticket war überraschend billig.,Билет оказался удивительно дешёвым.,Квиток виявився дивовижно дешевим.,
blau,-,adjective,синий,синій,Der Himmel ist heute klar und blau.,Небо сегодня ясное и голубое.,Небо сьогодні ясне і блакитне.,colors
bleiben,-,verb,оставаться,залишатися,Ich bleibe heute zu Hause.,Я сегодня останусь дома.,Я сьогодні залишуся вдома.,home
brauchen,-,verb,нуждаться,потребувати,Ich brauche Hilfe.,Мне нужна помощь.,Мені потрібна допомога.,health
braun,-,adjective,коричневый,коричневий,Meine Tasche ist dunkelbraun und klein.,Моя сумка тёмно-коричневая и маленькая.,Моя сумка темно-коричнева і маленька.,colors
breit,-,adjective,широкий,широкий,Die Straße ist hier sehr breit.,Дорога здесь очень широкая.,Дорога тут дуже широка.,
