word_de,article,pos,translation_ru,translation_uk,example_de,example_ru,example_uk,categories
bringen,-,verb,приносить,приносити,Er bringt mir Kaffee.,Он приносит мне кофе.,Він приносить мені каву.,food
danken,-,adjective,,,Es ist sehr danken.,Это очень danken.,Це дуже danken.,
denken,-,verb,думать,думати,Ich denke oft an dich.,Я часто думаю о тебе.,Я часто думаю про тебе.,
dick,-,adjective,толстый,товстий,Das Buch ist ziemlich dick.,Книга довольно толстая.,Книга досить товста.,
dort,-,adverb,там,там,Die Haltestelle ist dort.,Остановка там.,Зупинка там.,transport|city
draußen,-,adverb,снаружи,зовні,Wir warten draußen vor dem Gebäude.,Мы ждём снаружи перед зданием.,Ми чекаємо зовні перед будівлею.,
drei,-,number,три,три,Wir sind drei Personen.,Нас три человека.,Нас троє.,
dreizehn,-,adjective,,,Es ist sehr dreizehn.,Это очень dreizehn.,Це дуже dreizehn.,
dreißig,-,adjective,,,Es ist sehr dreißig.,Это очень dreißig.,Це дуже dreißig.,
drinnen,-,adverb,внутри,всередині,"Es ist kalt, wir bleiben drinnen.","Холодно, мы остаёмся внутри.","Холодно, ми залишаємося всередині.",
dritte,-,adjective,,,Es ist sehr dritte.,Это очень dritte.,Це дуже dritte.,
dumm,-,adjective,глупый,дурний,Das war eine dumme Idee.,Это была глупая идея.,Це була дурна ідея.,
durstig,-,adjective,испытывающий жажду,спраглий,Nach dem Lauf bin ich sehr durstig.,После пробежки я очень хочу пить.,Після пробіжки я дуже хочу пити.,health
duschen,-,verb,принимать душ,приймати душ,Ich dusche morgens kurz.,Я утром быстро принимаю душ.,Я зранку швидко приймаю душ.,home|health
dürfen,-,verb,мочь (с разрешения),можна (з дозволу),Hier darf man nicht rauchen.,Здесь нельзя курить.,Тут не можна палити.,
einfach,-,adjective,простой,простий,Die Lösung ist eigentlich ganz einfach.,Решение на самом деле довольно простое.,Рішення насправді доволі просте.,
einkaufen,-,adjective,,,Es ist sehr einkaufen.,Это очень einkaufen.,Це дуже einkaufen.,
einladen,-,verb,приглашать,запрошувати,Ich lade dich zum Essen ein.,Я приглашаю тебя на ужин.,Я запрошую тебе на вечерю.,food|family
eins,-,number,один,один,Ich habe nur eins dabei.,У меня с собой только один.,У мене з собою лише один.,
einschlafen,-,adjective,,,Es ist sehr einschlafen.,Это очень einschlafen.,Це дуже einschlafen.,
einsteigen,-,verb,садиться (в транспорт),сісти (в транспорт),Bitte steigen Sie ein!,"Пожалуйста, садитесь!","Будь ласка, сідайте!",transport
einundzwanzig,-,adjective,,,Es ist sehr einundzwanzig.,Это очень einundzwanzig.,Це дуже einundzwanzig.,
einverstanden,-,adjective,согласный,згодний,"Ja, ich bin damit einverstanden.","Да, я с этим согласен.","Так, я з цим згоден.",
elf,-,adjective,,,Es ist sehr elf.,Это очень elf.,Це дуже elf.,
empfehlen,-,adjective,,,Es ist sehr empfehlen.,Это очень empfehlen.,Це дуже empfehlen.,
enden,-,adjective,,,Es ist sehr enden.,Это очень enden.,Це дуже enden.,
eng,-,adjective,узкий,вузький,Die Hose ist mir zu eng.,Штаны мне слишком узкие.,Штани мені надто вузькі.,
entschuldigen (sich),-,phrase,,,entschuldigen (sich).,,,
erlaubt,-,adjective,разрешённый,дозволений,Hier ist Rauchen nicht erlaubt.,Здесь курить не разрешено.,Тут палити не дозволено.,other
erste,-,adjective,,,Es ist sehr erste.,Это очень erste.,Це дуже erste.,
essen,-,verb,есть,їсти,Ich esse gern Pizza.,Я люблю есть пиццу.,Я люблю їсти піцу.,food
fahren,-,verb,ехать/водить,їхати/водити,Ich fahre jeden Tag zur Arbeit.,Я каждый день езжу на работу.,Я щодня їжджу на роботу.,transport|study
fallen,-,verb,падать,падати,Die Blätter fallen im Herbst.,Листья падают осенью.,Листя падає восени.,weather|time
falsch,-,adjective,неправильный,неправильний,Das ist leider falsch.,"Это, к сожалению, неправильно.","Це, на жаль, неправильно.",study
feiern,-,verb,праздновать,святкувати,Wir feiern am Freitag.,Мы празднуем в пятницу.,Ми святкуємо в п’ятницю.,time
fernsehen,-,verb,смотреть телевизор,дивитися телевізор,Ich sehe abends fern.,Я вечером смотрю телевизор.,Я ввечері дивлюся телевізор.,home
fertig,-,adjective,готовый,готовий,Das Essen ist gleich fertig.,Еда скоро будет готова.,Їжа скоро буде готова.,food
finden,-,verb,находить,знаходити,Ich finde den Schlüssel nicht.,Я не могу найти ключ.,Я не можу знайти ключ.,home
fliegen,-,verb,лететь,летіти,Wir fliegen morgen nach Spanien.,Мы завтра летим в Испанию.,Ми завтра летимо до Іспанії.,transport
fragen,-,verb,спрашивать,питати,Ich frage den Lehrer.,Я спрашиваю учителя.,Я питаю вчителя.,study
frei,-,adjective,свободный,вільний,Ist dieser Platz noch frei?,Это место ещё свободно?,Це місце ще вільне?,city
freundlich,-,adjective,дружелюбный,дружній,Die Verkäuferin ist sehr freundlich.,Продавщица очень дружелюбная.,Продавчиня дуже привітна.,city
froh,-,adjective,радостный,радісний,Ich bin froh über die Nachricht.,Я рад этой новости.,Я радий цій новині.,
früh,-,adjective,рано,рано,Ich stehe früh auf.,Я рано встаю.,Я рано встаю.,time|health
frühstücken,-,verb,завтракать,снідати,Wir frühstücken um acht.,Мы завтракаем в восемь.,Ми снідаємо о восьмій.,food|time
funktionieren,-,verb,работать/функционировать,працювати/функціонувати,Die Lampe funktioniert wieder.,Лампа снова работает.,Лампа знову працює.,home
fünf,-,number,пять,п’ять,Ich warte noch fünf Minuten.,Я подожду ещё пять минут.,Я зачекаю ще п’ять хвилин.,time
fünfte,-,phrase,,,fünfte.,,,
fünfzehn,-,adjective,,,Es ist sehr fünfzehn.,Это очень fünfzehn.,Це дуже fünfzehn.,
fünfzig,-,adjective,,,Es ist sehr fünfzig.,Это очень fünfzig.,Це дуже fünfzig.,
ganz,-,adjective,,,Es ist sehr ganz.,Это очень ganz.,Це дуже ganz.,
gar,-,adjective,,,Es ist sehr gar.,Это очень gar.,Це дуже gar.,
geben,-,verb,давать,давати,Gib mir bitte das Buch.,"Дай мне, пожалуйста, книгу.","Дай мені, будь ласка, книжку.",study|home
gefallen,-,verb,нравиться,подобатися,Der Film gefällt mir.,Фильм мне нравится.,Фільм мені подобається.,
gehen,-,verb,идти,йти,Ich gehe zu Fuß nach Hause.,Я иду домой пешком.,Я йду пішки додому.,home|health
gehören,-,verb,принадлежать,належати,Das gehört mir.,Это принадлежит мне.,Це належить мені.,
gelb,-,adjective,жёлтый,жовтий,Die Banane ist gelb.,Банан жёлтый.,Банан жовтий.,colors|food
gemeinsam,-,adjective,,,Es ist sehr gemeinsam.,Это очень gemeinsam.,Це дуже gemeinsam.,
gerade,-,adverb,сейчас/только что,зараз/щойно,Ich komme gerade nach Hause.,Я как раз прихожу домой.,Я щойно приходжу додому.,time|home
gern,-,adjective,,,Es ist sehr gern.,Это очень gern.,Це дуже gern.,
gesund,-,adjective,,,Es ist sehr gesund.,Это очень gesund.,Це дуже gesund.,
gewinnen,-,verb,выигрывать,вигравати,Er gewinnt oft beim Spiel.,Он часто выигрывает в игре.,Він часто виграє у грі.,
glauben,-,verb,верить/думать,вірити/думати,Ich glaube dir.,Я верю тебе.,Я тобі вірю.,
glücklich,-,adjective,счастливый,щасливий,Heute bin ich sehr glücklich.,Сегодня я очень счастлив.,Сьогодні я дуже щасливий.,
grau,-,adjective,серый,сірий,Der Himmel ist heute grau.,Небо сегодня серое.,Небо сьогодні сіре.,colors|weather
groß,-,adjective,большой/высокий,великий/високий,Das Haus ist sehr groß.,Дом очень большой.,Дім дуже великий.,home
grün,-,adjective,зелёный,зелений,Der Salat ist frisch und grün.,Салат свежий и зелёный.,Салат свіжий і зелений.,colors|food
grüßen,-,verb,приветствовать,вітати,Ich grüße meine Nachbarn.,Я приветствую своих соседей.,Я вітаю своїх сусідів.,city|family
gut,-,adjective,,,Es ist sehr gut.,Это очень gut.,Це дуже gut.,
haben,-,verb,иметь,мати,Ich habe keine Zeit.,У меня нет времени.,У мене немає часу.,time
halten,-,verb,держать/останавливаться,тримати/зупинятися,Der Bus hält hier.,Автобус останавливается здесь.,Автобус зупиняється тут.,transport
heiß,-,adjective,горячий/жаркий,гарячий/спекотний,Der Tee ist zu heiß.,Чай слишком горячий.,Чай занадто гарячий.,food
heißen,-,verb,называться,називатися,Wie heißt du?,Как тебя зовут?,Як тебе звати?,
helfen,-,verb,помогать,допомагати,Er hilft seiner Mutter.,Он помогает своей маме.,Він допомагає своїй мамі.,family|health
hell,-,adjective,светлый,світлий,Das Zimmer ist hell und ruhig.,Комната светлая и тихая.,Кімната світла і тиха.,home
heute,-,adjective,,,Es ist sehr heute.,Это очень heute.,Це дуже heute.,
hier,-,adverb,здесь,тут,Ich wohne hier in der Nähe.,Я живу здесь поблизости.,Я живу тут неподалік.,home|city
holen,-,verb,забирать/приносить,забирати/приносити,Ich hole schnell den Arzt.,Я быстро приведу врача.,Я швидко покличу лікаря.,health|city
hundert,-,number,сто,сто,Im Lager sind hundert Stühle.,На складе сто стульев.,На складі сто стільців.,city|home
hungrig,-,adjective,голодный,голодний,Ich bin hungrig nach dem Sport.,Я голоден после спорта.,Я голодний після спорту.,health|food
höflich,-,adjective,,,Es ist sehr höflich.,Это очень höflich.,Це дуже höflich.,
hören,-,verb,слышать/слушать,чути/слухати,Ich höre gern Musik.,Я люблю слушать музыку.,Я люблю слухати музику.,
immer,-,adverb,всегда,завжди,Er kommt immer pünktlich.,Он всегда приходит вовремя.,Він завжди приходить вчасно.,time
jung,-,adjective,,,Es ist sehr jung.,Это очень jung.,Це дуже jung.,
kalt,-,adjective,холодный,холодний,Im Winter ist es kalt.,Зимой холодно.,Взимку холодно.,weather|time
kaputt,-,adjective,сломанный,зламаний,Mein Handy ist kaputt.,Мой телефон сломан.,Мій телефон зламаний.,
kaufen,-,verb,покупать,купувати,Ich kaufe Brot und Milch.,Я покупаю хлеб и молоко.,Я купую хліб і молоко.,food
kennen,-,verb,знать/быть знакомым,знати/бути знайомим,Ich kenne ihn gut.,Я его хорошо знаю.,Я його добре знаю.,
klar,-,adjective,ясный/понятный,ясний/зрозумілий,Ist das jetzt klar?,Теперь это ясно?,Тепер це зрозуміло?,
klein,-,adjective,маленький,маленький,Unsere Küche ist sehr klein.,Наша кухня очень маленькая.,Наша кухня дуже маленька.,home
klug,-,adjective,умный,розумний,Das ist eine kluge Idee.,Это умная мысль.,Це розумна думка.,
komisch,-,adjective,,,Es ist sehr komisch.,Это очень komisch.,Це дуже komisch.,
kommen,-,verb,приходить,приходити,Er kommt morgen zurück.,Он вернётся завтра.,Він повернеться завтра.,time
kosten,-,verb,стоить,коштувати,Wie viel kostet das?,Сколько это стоит?,Скільки це коштує?,city
krank,-,adjective,больной,хворий,Er ist krank und bleibt zu Hause.,Он болен и остаётся дома.,Він хворий і залишається вдома.,health|home
kurz,-,adjective,короткий,короткий,Die Pause ist sehr kurz.,Перерыв очень короткий.,Перерва дуже коротка.,study
können,-,verb,мочь (уметь),могти (вміти),Ich kann gut kochen.,Я умею хорошо готовить.,Я вмію добре готувати.,food
küssen,-,verb,целовать,цілувати,Sie küssen sich zum Abschied.,Они целуются на прощание.,Вони цілуються на прощання.,family
lachen,-,verb,смеяться,сміятися,Wir lachen über den Witz.,Мы смеёмся над шуткой.,Ми сміємося з жарту.,
lang,-,adjective,,,Es ist sehr lang.,Это очень lang.,Це дуже lang.,
langsam,-,adjective,медленный,повільний,Bitte fahr langsam.,"Пожалуйста, едь медленно.","Будь ласка, їдь повільно.",transport
laufen,-,verb,бежать/ходить,бігти/ходити,Ich laufe jeden Morgen im Park.,Я бегаю каждое утро в парке.,Я бігаю щоранку в парку.,health|city
laut,-,adjective,громкий,гучний,Die Musik ist zu laut.,Музыка слишком громкая.,Музика занадто гучна.,
leben,-,verb,жить,жити,Sie lebt in Deutschland.,Она живёт в Германии.,Вона живе в Німеччині.,home|city
leicht,-,adjective,лёгкий,легкий,Die Aufgabe ist leicht.,Задание лёгкое.,Завдання легке.,study
leise,-,adjective,тихий,тихий,Sei bitte leise.,"Пожалуйста, будь тише.","Будь ласка, будь тихіше.",
lernen,-,verb,учить/изучать,вчити/вивчати,Ich lerne Deutsch.,Я учу немецкий.,Я вчу німецьку.,study
lesen,-,verb,читать,читати,Ich lese gern Bücher.,Я люблю читать книги.,Я люблю читати книжки.,study
letzte,-,adjective,последний,останній,Das ist die letzte Frage.,Это последний вопрос.,Це останнє питання.,study
lieben,-,verb,любить,любити,Ich liebe meine Familie.,Я люблю свою семью.,Я люблю свою родину.,family
liegen,-,verb,лежать/находиться,лежати/знаходитися,Das Buch liegt auf dem Tisch.,Книга лежит на столе.,Книга лежить на столі.,home
lila,-,adjective,фиолетовый,фіолетовий,Ich mag lila Blumen.,Мне нравятся фиолетовые цветы.,Мені подобаються фіолетові квіти.,colors
machen,-,verb,делать,робити,Was machst du heute Abend?,Что ты делаешь сегодня вечером?,Що ти робиш сьогодні ввечері?,
macht,-,phrase,,,macht.,,,
manchmal,-,adverb,иногда,інколи,Manchmal trinke ich Tee.,Иногда я пью чай.,Інколи я п’ю чай.,food
meinen,-,verb,думать/полагать,вважати,"Ich meine, das ist besser so.","Я считаю, так лучше.","Я вважаю, так краще.",
mieten,-,verb,снимать,орендувати,Wir mieten eine kleine Wohnung.,Мы снимаем небольшую квартиру.,Ми орендуємо невелику квартиру.,home
mitbringen,-,verb,приносить с собой,приносити із собою,Bring bitte Brot mit.,"Пожалуйста, принеси с собой хлеб.","Будь ласка, принеси з собою хліб.",food
mitkommen,-,verb,идти вместе,йти разом,Kommst du morgen mit?,Пойдёшь завтра с нами?,Підеш завтра з нами?,
mitnehmen,-,verb,брать с собой,брати із собою,Nimm einen Regenschirm mit.,Возьми с собой зонт.,Візьми з собою парасольку.,weather
mitspielen,-,adjective,,,Es ist sehr mitspielen.,Это очень mitspielen.,Це дуже mitspielen.,
möchten,-,verb,хотеть бы,хотіти б,"Ich möchte einen Kaffee, bitte.","Я хотел бы кофе, пожалуйста.","Я хотів би каву, будь ласка.",food
mögen,-,verb,нравиться/любить,подобатися/любити,Ich mag frisches Obst.,Мне нравится свежие фрукты.,Мені подобаються свіжі фрукти.,food
möglich,-,adjective,возможный,можливий,Ist ein Termin morgen möglich?,Возможна встреча завтра?,Можлива зустріч завтра?,time|city
müde,-,adjective,уставший,втомлений,Ich bin nach der Arbeit müde.,Я устал после работы.,Я втомився після роботи.,health|study
müssen,-,verb,должен/нужно,мусити/потрібно,Ich muss früh aufstehen.,Мне нужно рано вставать.,Мені треба рано вставати.,
nah,-,adjective,близкий,близький,Die Schule ist ganz nah.,Школа совсем близко.,Школа зовсім близько.,study|city
nehmen,-,verb,брать,брати,Ich nehme die U-Bahn.,Я поеду на метро.,Я поїду метро.,transport
nennen,-,verb,называть,називати,Nenn mir bitte ein Beispiel.,"Назови, пожалуйста, пример.","Назви, будь ласка, приклад.",
nett,-,adjective,милый/приятный,милий/приємний,Die Nachbarn sind sehr nett.,Соседи очень милые.,Сусіди дуже приємні.,home|city
neu,-,adjective,новый,новий,Das Auto ist neu.,Машина новая.,Авто нове.,transport
neun,-,number,девять,дев’ять,Der Bus kommt um neun.,Автобус прибывает в девять.,Автобус прибуває о дев’ятій.,time|transport
neunzehn,-,adjective,,,Es ist sehr neunzehn.,Это очень neunzehn.,Це дуже neunzehn.,
neunzig,-,adjective,,,Es ist sehr neunzig.,Это очень neunzig.,Це дуже neunzig.,
nicht,-,adjective,,,Es ist sehr nicht.,Это очень nicht.,Це дуже nicht.,
nie,-,adverb,никогда,ніколи,Ich rauche nie.,Я никогда не курю.,Я ніколи не курю.,health
noch,-,adjective,,,Es ist sehr noch.,Это очень noch.,Це дуже noch.,
normal,-,adjective,нормальный,нормальний,Das ist völlig normal.,Это совершенно нормально.,Це цілком нормально.,
oft,-,adverb,часто,часто,Wir gehen oft spazieren.,Мы часто гуляем.,Ми часто гуляємо.,
orange,-,adjective,оранжевый,помаранчевий,Die Jacke ist orange.,Куртка оранжевая.,Куртка помаранчева.,colors|home
ordnen,-,adjective,,,Es ist sehr ordnen.,Это очень ordnen.,Це дуже ordnen.,
packen,-,adjective,,,Es ist sehr packen.,Это очень packen.,Це дуже packen.,
parken,-,verb,парковаться,паркуватися,Hier darf man nicht parken.,Здесь нельзя парковаться.,Тут не можна паркуватися.,transport
passen,-,adjective,,,Es ist sehr passen.,Это очень passen.,Це дуже passen.,
passieren,-,verb,случаться,траплятися,Was ist gestern passiert?,Что вчера случилось?,Що сталося вчора?,
probieren,-,verb,пробовать,пробувати,Möchtest du den Kuchen probieren?,Хочешь попробовать пирог?,Хочеш спробувати пиріг?,food
putzen,-,verb,убирать/чистить,прибирати/чистити,Ich putze heute die Küche.,Я сегодня убираю на кухне.,Я сьогодні прибираю на кухні.,home
rechts.,-,adjective,,,Es ist sehr rechts..,Это очень rechts..,Це дуже rechts..,
reden,-,verb,говорить/разговаривать,говорити/розмовляти,Wir reden später darüber.,Мы поговорим об этом позже.,Поговоримо про це пізніше.,
regnen,-,verb,идти (о дожде),йти (про дощ),Heute regnet es den ganzen Tag.,Сегодня весь день идёт дождь.,Сьогодні цілий день дощить.,weather
reich,-,adjective,богатый,багатий,"Er ist reich, aber bescheiden.","Он богат, но скромен.","Він багатий, але скромний.",
reisen,-,verb,путешествовать,подорожувати,Wir reisen im Sommer nach Italien.,Мы путешествуем летом в Италию.,Ми подорожуємо влітку до Італії.,transport
reiten,-,verb,ездить верхом,їздити верхи,Sie reitet jeden Sonntag.,Она ездит верхом каждое воскресенье.,Вона їздить верхи щонеділі.,
rennen,-,verb,бежать (быстро),бігти (швидко),Er rennt zur Haltestelle.,Он бежит к остановке.,Він біжить до зупинки.,
reservieren,-,verb,бронировать,бронювати,Ich reserviere einen Tisch.,Я забронирую столик.,Я забронюю столик.,city
richtig,-,adjective,правильный,правильний,Das ist die richtige Antwort.,Это правильный ответ.,Це правильна відповідь.,study
rosa,-,adjective,розовый,рожевий,Das Kleid ist rosa.,Платье розовое.,Сукня рожева.,colors
rot,-,adjective,красный,червоний,Die Ampel ist rot.,Светофор красный.,Світлофор червоний.,colors|transport
rufen,-,verb,звать/звонить,кликати/дзвонити,Ruf mich bitte heute an.,"Позвони мне сегодня, пожалуйста.","Подзвони мені сьогодні, будь ласка.",
ruhig,-,adjective,спокойный,спокійний,Bleib bitte ruhig.,"Оставайся спокойным, пожалуйста.","Залишайся спокійним, будь ласка.",
sagen,-,verb,говорить/сказать,казати/сказати,Sag mir bitte Bescheid.,"Скажи мне, пожалуйста, заранее.","Скажи мені, будь ласка, заздалегідь.",
sammeln,-,adjective,,,Es ist sehr sammeln.,Это очень sammeln.,Це дуже sammeln.,
sauber,-,adjective,чистый,чистий,Die Küche ist jetzt sauber.,Кухня теперь чистая.,Кухня тепер чиста.,home
sauer,-,adjective,кислый/сердитый,кислий/сердитий,Die Milch ist sauer geworden.,Молоко скисло.,Молоко скисло.,food
schaffen,-,verb,справляться/успевать,впоратися/встигати,Ich schaffe das bis morgen.,Я справлюсь с этим до завтра.,Я впораюся з цим до завтра.,
scharf,-,adjective,острый,гострий,Das Messer ist sehr scharf.,Нож очень острый.,Ніж дуже гострий.,home
schauen,-,verb,смотреть,дивитися,"Schau mal, das ist schön.","Посмотри, это красиво.","Подивись, це гарно.",
