word_de,article,pos,translation_ru,translation_uk,example_de,example_ru,example_uk,categories
,-,adjective,,,Es ist sehr null.,Это очень null.,Це дуже null.,
Abend,der,noun,вечер,вечір,Wir sehen uns heute Abend.,Увидимся сегодня вечером.,Побачимось сьогодні ввечері.,time
Adresse,die,noun,адрес,адреса,Schicken Sie mir bitte Ihre Adresse.,"Пришлите, пожалуйста, ваш адрес.","Надішліть, будь ласка, вашу адресу.",city
Alles klar,-,phrase,всё ясно,все зрозуміло,"Alles klar, danke.","Всё ясно, спасибо.","Все зрозуміло, дякую.",
"Am Montag, am Wochenende",-,phrase,,,"Am Montag, am Wochenende.",,,
"Am Morgen, am Abend, am Wochenende",-,phrase,,,"Am Morgen, am Abend, am Wochenende.",,,
Anruf,der,noun,звонок,дзвінок,Ich bekomme später einen Anruf.,Позже у меня будет звонок.,Пізніше у мене буде дзвінок.,other
Antwort,die,noun,ответ,відповідь,Danke für Ihre schnelle Antwort.,Спасибо за быстрый ответ.,Дякую за швидку відповідь.,other
Apfel,der,noun,яблоко,яблуко,Ich esse jeden Tag einen Apfel.,Я ем яблоко каждый день.,Я щодня їм яблуко.,food
Apotheke,die,noun,аптека,аптека,Die Apotheke macht um acht auf.,Аптека открывается в восемь.,Аптека відкривається о восьмій.,health|city
April,der,noun,апрель,квітень,Im April regnet es oft.,В апреле часто идёт дождь.,У квітні часто йде дощ.,time
Arbeit,die,noun,работа,робота,Ich gehe gleich zur Arbeit.,Я сейчас иду на работу.,Я зараз іду на роботу.,study
Arm,der,noun,рука,рука,Mein Arm tut heute ein bisschen weh.,Моя рука сегодня немного болит.,Моя рука сьогодні трохи болить.,health
Auf Wiedersehen,-,phrase,до свидания,до побачення,Auf Wiedersehen und einen schönen Tag.,До свидания и хорошего дня.,До побачення і гарного дня.,
Aufgabe,die,noun,задание,завдання,Die Aufgabe ist nicht schwer.,Задание несложное.,Завдання не складне.,study
August,der,noun,август,серпень,Im August fahren viele in Urlaub.,В августе многие едут в отпуск.,У серпні багато хто їде у відпустку.,time
Auskunft,die,noun,справка,довідка,Fragen Sie an der Auskunft nach.,Спросите на стойке информации.,Запитайте на стійці інформації.,city
Ausweis,der,noun,удостоверение,посвідчення,Ich habe meinen Ausweis dabei.,У меня с собой удостоверение.,У мене з собою посвідчення.,other
Automat,der,noun,автомат,автомат,Der Automat nimmt nur Münzen.,Автомат принимает только монеты.,Автомат приймає лише монети.,city
Bad,das,noun,ванная,ванна,Das Bad ist im ersten Stock.,Ванная на первом этаже.,Ванна на першому поверсі.,home
Bahnhof,der,noun,вокзал,вокзал,Wir treffen uns am Bahnhof.,Встречаемся на вокзале.,Зустрічаємося на вокзалі.,transport|city
Ball,der,noun,мяч,м’яч,Der Ball liegt im Garten.,Мяч лежит в саду.,М’яч лежить у саду.,other
Banane,die,noun,банан,банан,Die Banane ist schon reif.,Банан уже спелый.,Банан уже стиглий.,food
Bank,die,noun,банк,банк,Ich muss heute zur Bank.,Мне сегодня нужно в банк.,Мені сьогодні потрібно в банк.,city
Basketball,der,noun,баскетбол,баскетбол,Am Abend spielen wir Basketball.,Вечером мы играем в баскетбол.,Ввечері ми граємо в баскетбол.,other
Bett,das,noun,кровать,ліжко,Ich gehe früh ins Bett.,Я рано ложусь спать.,Я рано лягаю спати.,home
Bier,das,noun,пиво,пиво,"Ein kaltes Bier, bitte.","Холодное пиво, пожалуйста.","Холодне пиво, будь ласка.",food
Bild,das,noun,картинка,картинка,Das Bild hängt an der Wand.,Картинка висит на стене.,Картинка висить на стіні.,home
Bis bald,-,phrase,до скорого,до скорого,Bis bald und gute Reise!,До скорого и хорошей дороги!,До скорого і гарної дороги!,transport
Bis später,-,phrase,,,Bis später.,,,
Bitte,-,phrase,пожалуйста,будь ласка,"Eine Tüte, bitte.","Пакет, пожалуйста.","Пакет, будь ласка.",
Bitte schön!,-,phrase,,,Bitte schön!.,,,
Bleistift,der,noun,карандаш,олівець,Hast du einen Bleistift für mich.,У тебя есть карандаш для меня.,У тебе є олівець для мене.,study
Blume,die,noun,цветок,квітка,Die Blume riecht sehr gut.,Цветок очень приятно пахнет.,Квітка дуже добре пахне.,other
Brille,die,noun,очки,окуляри,Ich finde meine Brille nicht.,Я не могу найти свои очки.,Я не можу знайти свої окуляри.,health
Brot,das,noun,хлеб,хліб,Ich kaufe noch frisches Brot.,Куплю ещё свежий хлеб.,Куплю ще свіжий хліб.,food
Butter,die,noun,масло,масло,Bitte reich mir die Butter.,"Передай, пожалуйста, масло.","Передай, будь ласка, масло.",food
Bäckerei,die,noun,пекарня,пекарня,Die Bäckerei hat frisches Brot.,В пекарне есть свежий хлеб.,У пекарні є свіжий хліб.,city|food
CD,die,noun,диск,диск,Ich höre die neue CD im Auto.,Я слушаю новый диск в машине.,Я слухаю новий диск у машині.,other
Cent,der,noun,цент,цент,Das kostet zehn Cent.,Это стоит десять цент.,Це коштує десять цент.,other
Chef,der,noun,шеф,шеф,Der Chef ist heute im Büro.,Шеф сегодня в офисе.,Шеф сьогодні в офісі.,study
Computer,der,noun,компьютер,комп’ютер,Der Computer startet langsam.,Компьютер запускается медленно.,Комп’ютер запускається повільно.,study
Couch,die,noun,диван,диван,Wir sitzen zusammen auf der Couch.,Мы сидим вместе на диване.,Ми сидимо разом на дивані.,home
Dank,der,noun,благодарность,подяка,Vielen Dank für Ihre Hilfe.,Большое спасибо за помощь.,Дуже дякую за допомогу.,other
Danke,-,phrase,спасибо,дякую,Danke für Ihre Hilfe.,Спасибо за вашу помощь.,Дякую за вашу допомогу.,
Darf ich,-,phrase,,,Darf ich.,,,
Dezember,der,noun,декабрь,грудень,Im Dezember ist es kalt.,В декабре холодно.,У грудні холодно.,time
"Die Rechnung, bitte",-,phrase,"счёт, пожалуйста","рахунок, будь ласка","Die Rechnung, bitte. Danke.","Счёт, пожалуйста. Спасибо.","Рахунок, будь ласка. Дякую.",city|food
Dienstag,der,noun,вторник,вівторок,Der Termin ist am Dienstag.,Встреча во вторник.,Зустріч у вівторок.,time
Disco,die,noun,дискотека,дискотека,Heute Abend gehen wir in die Disco.,Сегодня вечером идём на дискотеку.,Сьогодні ввечері йдемо на дискотеку.,city
Dollar,der,noun,доллар,долар,Das kostet zehn Dollar.,Это стоит десять доллар.,Це коштує десять долар.,other
Donnerstag,der,noun,четверг,четвер,Der Kurs ist am Donnerstag.,Курс проходит по четвергам.,Курс у четвер.,time
Dusche,die,noun,душ,душ,Die Dusche funktioniert wieder.,Душ снова работает.,Душ знову працює.,home
E-Mail,die,noun,электронная почта,електронна пошта,Ich schreibe dir gleich eine E‑Mail.,Я сейчас напишу тебе письмо.,Зараз напишу тобі листа.,other
"Einen Kaffee, bitte",-,phrase,"кофе, пожалуйста","каву, будь ласка","Einen Kaffee, bitte. Ohne Zucker.","Кофе, пожалуйста. Без сахара.","Каву, будь ласка. Без цукру.",food
"Einen Moment, bitte",-,phrase,"минуточку, пожалуйста","хвилинку, будь ласка","Einen Moment, bitte. Ich komme gleich.","Минуточку, пожалуйста. Я сейчас приду.","Хвилинку, будь ласка. Я зараз прийду.",
Eintritt,der,noun,вход,вхід,Der Eintritt kostet fünf Euro.,Вход стоит пять евро.,Вхід коштує п’ять євро.,city
Eis,das,noun,мороженое,морозиво,Die Kinder möchten Eis essen.,Дети хотят мороженое.,Діти хочуть морозиво.,food
Eltern,die,noun,родители,батьки,Meine Eltern wohnen in Köln.,Мои родители живут в Кёльне.,Мої батьки живуть у Кельні.,family
Entschuldigung,die,noun,извинение,вибачення,"Entschuldigung, ich komme zu spät.","Извините, я опоздал.","Вибачте, я запізнився.",other
Entschuldigung,-,phrase,извините,вибачте,"Entschuldigung, wo ist die Toilette?","Извините, где туалет?","Вибачте, де туалет?",city
"Entschuldigung, ich suche",-,phrase,,,"Entschuldigung, ich suche.",,,
Erdbeere,die,noun,клубника,полуниця,Die Erdbeere schmeckt süß.,Клубника сладкая на вкус.,Полуниця солодка на смак.,food
Es ist,-,phrase,,,Es ist.,,,
Es ist Viertel nach,-,phrase,,,Es ist Viertel nach.,,,
Es ist halb (acht),-,phrase,,,Es ist halb (acht).,,,
Es ist kalt,-,phrase,,,Es ist kalt.,,,
Es ist warm,-,phrase,,,Es ist warm.,,,
Es ist windig,-,phrase,,,Es ist windig.,,,
Es regnet,-,phrase,,,Es regnet.,,,
Es schneit,-,phrase,,,Es schneit.,,,
Es tut mir leid,-,phrase,,,Es tut mir leid.,,,
Euro,der,noun,евро,євро,Das kostet zehn Euro.,Это стоит десять евро.,Це коштує десять євро.,city
Europakarte,die,noun,карта Европы,карта Європи,Die Europakarte hängt im Klassenraum.,Карта Европы висит в классе.,Карту Європи повісили в класі.,study
Fahrplan,der,noun,расписание,розклад,Der Fahrplan hängt am Bahnhof.,Расписание висит на вокзале.,Розклад висить на вокзалі.,transport
Fahrrad,das,noun,велосипед,велосипед,Er fährt jeden Tag mit dem Fahrrad.,Он каждый день ездит на велосипеде.,Він щодня їздить на велосипеді.,transport
Familienname,der,noun,фамилия,прізвище,Wie ist Ihr Familienname.,Как ваша фамилия.,Яке у вас прізвище.,family
Februar,der,noun,февраль,лютий,Der Februar hat 28 Tage.,В феврале 28 дней.,У лютому 28 днів.,time
Fenster,das,noun,окно,вікно,Bitte mach das Fenster zu.,"Пожалуйста, закрой окно.","Будь ласка, закрий вікно.",home
Fest,das,noun,праздник,свято,Am Wochenende ist ein großes Fest.,В выходные большой праздник.,На вихідних велике свято.,city
Film,der,noun,фильм,фільм,Wir sehen heute einen Film.,Сегодня смотрим фильм.,Сьогодні дивимося фільм.,other
Flasche,die,noun,бутылка,пляшка,Die Flasche ist fast leer.,Бутылка почти пустая.,Пляшка майже порожня.,other
Fleisch,das,noun,мясо,м’ясо,Er isst kein Fleisch.,Он не ест мясо.,Він не їсть м’ясо.,food
Formular,das,noun,бланк,бланк,Füllen Sie bitte das Formular aus.,"Пожалуйста, заполните бланк.","Будь ласка, заповніть бланк.",study
Franken,der,noun,франк,франк,Das kostet zehn Franken.,Это стоит десять франк.,Це коштує десять франк.,other
Frau,die,noun,женщина,жінка,Die Frau an der Kasse lächelt.,Женщина на кассе улыбается.,Жінка на касі усміхається.,other
Freitag,der,noun,пятница,п’ятниця,Am Freitag habe ich frei.,В пятницу у меня выходной.,У п’ятницю в мене вихідний.,time
Freund,der,noun,друг,друг,Mein Freund wohnt in München.,Мой друг живёт в Мюнхене.,Мій друг живе в Мюнхені.,family
Freundin,die,noun,подруга,подруга,Meine Freundin arbeitet hier.,Моя подруга работает здесь.,Моя подруга працює тут.,family
Freut mich!,-,phrase,,,Freut mich!.,,,
Frühling,-,adjective,,,Es ist sehr Frühling.,Это очень Frühling.,Це дуже Frühling.,
Frühstück,das,noun,завтрак,сніданок,Wir machen am Sonntag ein langes Frühstück.,В воскресенье у нас долгий завтрак.,У неділю в нас довгий сніданок.,food
Gebäude,das,noun,здание,будівля,Das neue Gebäude ist fast fertig.,Новое здание почти готово.,Нова будівля майже готова.,city|home
Gemüse,das,noun,овощи,овочі,Ich kaufe frisches Gemüse auf dem Markt.,Я покупаю свежие овощи на рынке.,Купую свіжі овочі на ринку.,food
"Geradeaus, dann links",-,phrase,,,"Geradeaus, dann links.",,,
Gern geschehen,-,phrase,не за что,нема за що,"Gern geschehen, kein Problem.","Не за что, без проблем.","Нема за що, без проблем.",
Geschenk,das,noun,подарок,подарунок,Das Geschenk ist für meine Mutter.,Подарок для моей мамы.,Подарунок для моєї мами.,other
Geschäft,das,noun,магазин,крамниця,Das Geschäft macht um neun auf.,Магазин открывается в девять.,Крамниця відкривається о дев’ятій.,city
Gesicht,das,noun,лицо,обличчя,Er wäscht sich das Gesicht.,Он умывает лицо.,Він умиває обличчя.,health
Gesundheit,-,phrase,будь здоров,будь здоров,Gesundheit!,Будь здоров!,Будь здоров!,health
Gesundheit!,-,adjective,,,Es ist sehr Gesundheit!.,Это очень Gesundheit!.,Це дуже Gesundheit!.,
Getränk,das,noun,напиток,напій,Ein kaltes Getränk wäre jetzt gut.,Хорошо бы сейчас холодный напиток.,Зараз добре було б холодний напій.,food
Glas,das,noun,стакан,склянка,"Ein Glas Wasser, bitte.","Стакан воды, пожалуйста.","Склянку води, будь ласка.",other
Grad,das,noun,градус,градус,Das kostet zehn Grad.,Это стоит десять градус.,Це коштує десять градус.,other
Gramm,das,noun,грамм,грам,Ich brauche zweihundert Gramm Käse.,Мне нужно двести граммов сыра.,Мені потрібно двісті грамів сиру.,food
Großmutter,die,noun,бабушка,бабуся,Meine Großmutter backt gerne Kuchen.,Моя бабушка любит печь пироги.,Моя бабуся любить пекти пироги.,family
Großvater,der,noun,дедушка,дідусь,Mein Großvater erzählt oft Geschichten.,Мой дедушка часто рассказывает истории.,Мій дідусь часто розповідає історії.,family
Grüß Gott,-,phrase,,,Grüß Gott.,,,
"Gut, danke",-,phrase,,,"Gut, danke.",,,
Gute Besserung,-,phrase,скорейшего выздоровления,швидкого одужання,Gute Besserung und viel Ruhe.,Скорейшего выздоровления и больше отдыха.,Швидкого одужання і більше відпочинку.,health
Gute Nacht,-,phrase,спокойной ночи,на добраніч,Gute Nacht und schlaf gut.,Спокойной ночи и сладких снов.,На добраніч і солодких снів.,time|health
Guten Abend,-,phrase,добрый вечер,доброго вечора,"Guten Abend, meine Damen und Herren.","Добрый вечер, дамы и господа.","Доброго вечора, пані та панове.",time
Guten Morgen,-,phrase,доброе утро,доброго ранку,"Guten Morgen, Frau Keller.","Доброе утро, госпожа Келлер.","Доброго ранку, пані Келлер.",time
Guten Tag,-,phrase,добрый день,доброго дня,"Guten Tag, kann ich helfen?","Добрый день, могу помочь?","Доброго дня, можу допомогти?",
Haar,das,noun,волос,волосся,Mein Haar ist heute zu lang.,Сегодня у меня слишком длинные волосы.,Сьогодні в мене занадто довге волосся.,health
Hafen,der,noun,порт,порт,Der Hafen ist nicht weit von hier.,Порт недалеко отсюда.,Порт недалеко звідси.,city|transport
Hallo,-,phrase,привет,привіт,"Hallo, wie geht es dir?","Привет, как ты?","Привіт, як ти?",
"Hallo, hier spricht",-,phrase,,,"Hallo, hier spricht.",,,
Handy,das,noun,мобильный телефон,мобільний телефон,Mein Handy liegt im Wohnzimmer.,Мой телефон лежит в гостиной.,Мій телефон лежить у вітальні.,other
Haus,das,noun,дом,дім,Ihr Haus hat einen kleinen Garten.,Их дом имеет маленький сад.,Їхній дім має маленький сад.,home
Herbst,-,adjective,,,Es ist sehr Herbst.,Это очень Herbst.,Це дуже Herbst.,
Herr,der,noun,господин,пан,Herr Becker wartet schon.,Господин Беккер уже ждёт.,Пан Беккер уже чекає.,other
"Heute, morgen, übermorgen",-,phrase,,,"Heute, morgen, übermorgen.",,,
Hier bitte,-,phrase,,,Hier bitte.,,,
Hilfe,-,phrase,помогите,допоможіть,"Hilfe, ich habe mich verletzt.","Помогите, я поранился.","Допоможіть, я поранився.",health
Hund,der,noun,собака,собака,Der Hund schläft unter dem Tisch.,Собака спит под столом.,Собака спить під столом.,other
Ich arbeite als ...,-,phrase,я работаю ...,я працюю ...,Ich arbeite als Verkäufer.,Я работаю продавцом.,Я працюю продавцем.,study|city
Ich bin Schüler,-,phrase,,,Ich bin Schüler.,,,
Ich bin glücklich,-,phrase,,,Ich bin glücklich.,,,
Ich bin krank,-,phrase,,,Ich bin krank.,,,
Ich bin müde,-,phrase,,,Ich bin müde.,,,
Ich denke,-,phrase,,,Ich denke.,,,
Ich finde,-,phrase,,,Ich finde.,,,
Ich glaube,-,phrase,,,Ich glaube.,,,
Ich habe eine Frage,-,phrase,у меня есть вопрос,в мене є питання,"Entschuldigung, ich habe eine Frage.","Извините, у меня есть вопрос.","Вибачте, в мене є питання.",
Ich heiße ...,-,phrase,меня зовут ...,мене звати ...,Ich heiße Anna Müller.,Меня зовут Анна Мюллер.,Мене звати Анна Мюллер.,
Ich hätte gern,-,phrase,,,Ich hätte gern.,,,
Ich komme aus ...,-,phrase,я из ...,я з ...,Ich komme aus der Ukraine.,Я из Украины.,Я з України.,
Ich mag,-,phrase,,,Ich mag.,,,
Ich möchte gern,-,phrase,,,Ich möchte gern.,,,
Ich möchte mit,-,phrase,,,Ich möchte mit.,,,
Ich spreche nur wenig Deutsch,-,phrase,я говорю чуть-чуть по‑немецки,я трохи говорю німецькою,Ich spreche nur wenig Deutsch.,Я говорю немного по‑немецки.,Я трохи говорю німецькою.,
Ich verstehe nicht,-,phrase,я не понимаю,я не розумію,"Entschuldigung, ich verstehe nicht.","Извините, я не понимаю.","Вибачте, я не розумію.",
Ich weiß nicht,-,phrase,,,Ich weiß nicht.,,,
Ich wohne in ...,-,phrase,я живу в ...,я живу в ...,Ich wohne in Berlin.,Я живу в Берлине.,Я живу в Берліні.,home|city
Ja,-,adjective,,,Es ist sehr Ja.,Это очень Ja.,Це дуже Ja.,
Jahr – die Jahre,-,phrase,,,Jahr – die Jahre.,,,
Januar,der,noun,январь,січень,Der Januar ist oft sehr kalt.,Январь часто очень холодный.,Січень часто дуже холодний.,time
Juli,der,noun,июль,липень,Im Juli fahren wir ans Meer.,В июле мы едем к морю.,У липні ми їдемо до моря.,time
Junge,der,noun,мальчик,хлопчик,Der Junge spielt im Hof Fußball.,Мальчик играет во дворе в футбол.,Хлопчик грає у дворі у футбол.,family
Juni,der,noun,июнь,червень,Der Kurs beginnt im Juni.,Курс начинается в июне.,Курс починається в червні.,time
Kannst du mir helfen?,-,phrase,,,Kannst du mir helfen?.,,,
Karte,die,noun,карта,карта,Haben Sie eine Stadtkarte für mich?,У вас есть карта города для меня?,Маєте міську карту для мене?,city
Kartoffel,die,noun,картофель,картопля,Ich kaufe heute Kartoffeln für die Suppe.,Я покупаю сегодня картошку для супа.,Купую сьогодні картоплю для супу.,food
Katze,die,noun,кошка,кіт/кицька,Unsere Katze schläft auf dem Sofa.,Наша кошка спит на диване.,Наша кицька спить на дивані.,
Kein Problem,-,phrase,без проблем,без проблем,"Kein Problem, ich mache das.","Без проблем, я сделаю это.","Без проблем, я це зроблю.",
Keller,der,noun,подвал,підвал,Die Getränke stehen im Keller.,Напитки стоят в подвале.,Напої стоять у підвалі.,home
Kilogramm,das,noun,килограмм,кілограм,Die Tasche wiegt zwei Kilogramm.,Сумка весит два килограмма.,Сумка важить два кілограми.,other
Kilometer,der,noun,километр,кілометр,Es sind fünf Kilometer bis dort.,Туда пять километров.,Туди п’ять кілометрів.,transport
Kind,das,noun,ребёнок,дитина,Das Kind malt ein Bild.,Ребёнок рисует картинку.,Дитина малює картинку.,family
Kirche,die,noun,церковь,церква,Die Kirche ist im Zentrum der Stadt.,Церковь находится в центре города.,Церква в центрі міста.,city
Klasse,die,noun,класс,клас,Unsere Klasse hat heute Sport.,У нашего класса сегодня спорт.,У нашого класу сьогодні фізкультура.,study
Kleid,das,noun,платье,сукня,Das Kleid passt dir sehr gut.,Платье тебе очень подходит.,Сукня тобі дуже пасує.,
Kleidung,die,noun,одежда,одяг,Ich brauche warme Kleidung für den Winter.,Мне нужна тёплая одежда на зиму.,Мені потрібен теплий одяг на зиму.,
Kuchen,der,noun,пирог,пиріг,Der Kuchen schmeckt ausgezeichnet.,Пирог на вкус отличный.,Пиріг смакує чудово.,food
Kultur,die,noun,культура,культура,Die Stadt hat eine reiche Kultur.,В городе богатая культура.,Місто має багату культуру.,city
Käse,der,noun,сыр,сир,Magst du Käse auf dem Brot?,Ты любишь сыр на хлебе?,Ти любиш сир на хлібі?,food
Können Sie bitte wiederholen?,-,phrase,,,Können Sie bitte wiederholen?.,,,
Küche,die,noun,кухня,кухня,"Die Küche ist klein, aber praktisch.","Кухня маленькая, но удобная.","Кухня маленька, але зручна.",home
Lampe,die,noun,лампа,лампа,Die Lampe über dem Tisch ist neu.,Лампа над столом новая.,Лампа над столом нова.,home
Land,das,noun,страна,країна,Deutschland ist ein schönes Land.,Германия — красивая страна.,Німеччина — гарна країна.,
